{
  "schema_version": "1.0.0",
  "evidence_package_id": "PROC-B0005-EPS001",
  "dataset": "procurement",
  "batch_id": 5,
  "status": "CERTIFIED",
  "created_utc": "2026-08-12T05:11:33Z",
  "summary": {
    "passed": 37,
    "failed": 0,
    "warnings": 1,
    "total": 38
  },
  "checks": [
    {
      "code": "COUNT-001",
      "name": "Raw observations exist",
      "category": "batch_completeness",
      "status": "PASS",
      "message": "The certification check passed.",
      "evidence": {
        "observed_value": 120813,
        "expected_value": "greater than 0"
      }
    },
    {
      "code": "COUNT-002",
      "name": "Normalized transactions exist",
      "category": "batch_completeness",
      "status": "PASS",
      "message": "The certification check passed.",
      "evidence": {
        "observed_value": 120813,
        "expected_value": "greater than 0"
      }
    },
    {
      "code": "COUNT-003",
      "name": "Normalized awards represented",
      "category": "batch_completeness",
      "status": "PASS",
      "message": "The certification check passed.",
      "evidence": {
        "observed_value": 111083,
        "expected_value": "greater than 0"
      }
    },
    {
      "code": "COUNT-004",
      "name": "Raw and normalized counts reconcile",
      "category": "batch_completeness",
      "status": "PASS",
      "message": "The certification check passed.",
      "evidence": {
        "observed_value": 120813,
        "expected_value": 120813
      }
    },
    {
      "code": "DUP-001",
      "name": "Raw source-row identifiers are unique",
      "category": "duplicate_detection",
      "status": "PASS",
      "message": "The certification check passed.",
      "evidence": {
        "observed_value": 0,
        "expected_value": 0
      }
    },
    {
      "code": "DUP-002",
      "name": "Transaction source-row identifiers are unique",
      "category": "duplicate_detection",
      "status": "PASS",
      "message": "The certification check passed.",
      "evidence": {
        "observed_value": 0,
        "expected_value": 0
      }
    },
    {
      "code": "FK-001",
      "name": "Transaction award references resolve",
      "category": "referential_integrity",
      "status": "PASS",
      "message": "The certification check passed.",
      "evidence": {
        "observed_value": 0,
        "expected_value": 0
      }
    },
    {
      "code": "FK-002",
      "name": "Award recipient references resolve",
      "category": "referential_integrity",
      "status": "PASS",
      "message": "The certification check passed.",
      "evidence": {
        "observed_value": 0,
        "expected_value": 0
      }
    },
    {
      "code": "FK-003",
      "name": "Awarding-agency references resolve",
      "category": "referential_integrity",
      "status": "PASS",
      "message": "The certification check passed.",
      "evidence": {
        "observed_value": 0,
        "expected_value": 0
      }
    },
    {
      "code": "FK-004",
      "name": "Awarding-subagency references resolve",
      "category": "referential_integrity",
      "status": "PASS",
      "message": "The certification check passed.",
      "evidence": {
        "observed_value": 0,
        "expected_value": 0
      }
    },
    {
      "code": "FK-005",
      "name": "Funding-agency references resolve",
      "category": "referential_integrity",
      "status": "PASS",
      "message": "The certification check passed.",
      "evidence": {
        "observed_value": 0,
        "expected_value": 0
      }
    },
    {
      "code": "FK-006",
      "name": "Funding-subagency references resolve",
      "category": "referential_integrity",
      "status": "PASS",
      "message": "The certification check passed.",
      "evidence": {
        "observed_value": 0,
        "expected_value": 0
      }
    },
    {
      "code": "FK-007",
      "name": "Place transaction references resolve",
      "category": "referential_integrity",
      "status": "PASS",
      "message": "The certification check passed.",
      "evidence": {
        "observed_value": 0,
        "expected_value": 0
      }
    },
    {
      "code": "FK-008",
      "name": "Canonical-place references resolve",
      "category": "referential_integrity",
      "status": "PASS",
      "message": "The certification check passed.",
      "evidence": {
        "observed_value": 0,
        "expected_value": 0
      }
    },
    {
      "code": "FK-009",
      "name": "State references resolve",
      "category": "referential_integrity",
      "status": "PASS",
      "message": "The certification check passed.",
      "evidence": {
        "observed_value": 0,
        "expected_value": 0
      }
    },
    {
      "code": "FK-010",
      "name": "County references resolve",
      "category": "referential_integrity",
      "status": "PASS",
      "message": "The certification check passed.",
      "evidence": {
        "observed_value": 0,
        "expected_value": 0
      }
    },
    {
      "code": "FK-011",
      "name": "NAICS references resolve",
      "category": "referential_integrity",
      "status": "PASS",
      "message": "The certification check passed.",
      "evidence": {
        "observed_value": 0,
        "expected_value": 0
      }
    },
    {
      "code": "FK-012",
      "name": "PSC references resolve",
      "category": "referential_integrity",
      "status": "PASS",
      "message": "The certification check passed.",
      "evidence": {
        "observed_value": 0,
        "expected_value": 0
      }
    },
    {
      "code": "REL-001",
      "name": "Recipient relationships complete",
      "category": "relationship_completeness",
      "status": "PASS",
      "message": "The certification check passed.",
      "evidence": {
        "observed_value": "111083/111083 (100.00%)",
        "expected_value": "100.00%"
      }
    },
    {
      "code": "REL-002",
      "name": "Awarding-agency relationships complete",
      "category": "relationship_completeness",
      "status": "PASS",
      "message": "The certification check passed.",
      "evidence": {
        "observed_value": "111083/111083 (100.00%)",
        "expected_value": "100.00%"
      }
    },
    {
      "code": "REL-003",
      "name": "Awarding-subagency relationships complete",
      "category": "relationship_completeness",
      "status": "PASS",
      "message": "The certification check passed.",
      "evidence": {
        "observed_value": "111083/111083 (100.00%)",
        "expected_value": "100.00%"
      }
    },
    {
      "code": "REL-004",
      "name": "Funding-agency relationships complete",
      "category": "relationship_completeness",
      "status": "PASS",
      "message": "The certification check passed.",
      "evidence": {
        "observed_value": "111083/111083 (100.00%)",
        "expected_value": "100.00%"
      }
    },
    {
      "code": "REL-005",
      "name": "Funding-subagency relationships complete",
      "category": "relationship_completeness",
      "status": "PASS",
      "message": "The certification check passed.",
      "evidence": {
        "observed_value": "111083/111083 (100.00%)",
        "expected_value": "100.00%"
      }
    },
    {
      "code": "REL-006",
      "name": "Award-recipient history resolves",
      "category": "relationship_completeness",
      "status": "PASS",
      "message": "The certification check passed.",
      "evidence": {
        "relationship_count": 111089,
        "orphan_count": 0,
        "observed_value": "111089/111089",
        "expected_value": "all relationships"
      }
    },
    {
      "code": "REL-007",
      "name": "Recipient-parent history resolves",
      "category": "relationship_completeness",
      "status": "PASS",
      "message": "The certification check passed.",
      "evidence": {
        "relationship_count": 5031,
        "unresolved_recipient_count": 0,
        "observed_value": "5031/5031",
        "expected_value": "all relationships"
      }
    },
    {
      "code": "REL-008",
      "name": "Award-recipient history coverage complete",
      "category": "relationship_completeness",
      "status": "PASS",
      "message": "The certification check passed.",
      "evidence": {
        "batch_awards": 111083,
        "history_awards": 111083,
        "observed_value": "111083/111083",
        "expected_value": "all batch awards"
      }
    },
    {
      "code": "PROV-001",
      "name": "Normalization exception keys are unique",
      "category": "normalization_provenance",
      "status": "PASS",
      "message": "The certification check passed.",
      "evidence": {
        "observed_value": 0,
        "expected_value": 0
      }
    },
    {
      "code": "PROV-002",
      "name": "Exception source rows resolve",
      "category": "normalization_provenance",
      "status": "PASS",
      "message": "The certification check passed.",
      "evidence": {
        "observed_value": 0,
        "expected_value": 0
      }
    },
    {
      "code": "PROV-003",
      "name": "NAICS aliases reconcile",
      "category": "normalization_provenance",
      "status": "PASS",
      "message": "The certification check passed.",
      "evidence": {
        "alias_rows": 613,
        "alias_occurrences": 120811,
        "source_occurrences": 120811,
        "observed_value": "120811/120811",
        "expected_value": "all described source occurrences"
      }
    },
    {
      "code": "PROV-004",
      "name": "PSC aliases reconcile",
      "category": "normalization_provenance",
      "status": "PASS",
      "message": "The certification check passed.",
      "evidence": {
        "alias_rows": 1169,
        "alias_occurrences": 120813,
        "source_occurrences": 120813,
        "observed_value": "120813/120813",
        "expected_value": "all described source occurrences"
      }
    },
    {
      "code": "PROV-005",